<data xmlns:xsi="http://www.w3.org/2001/XMLSchema-instance" xsi:noNamespaceSchemaLocation="../schemas/areas.xsd">
    <area id="street_corner_fifth_sinclair_1" room="street_corner_fifth_sinclair">
        <link type="basic" dist="CLOSE" dir="E" area="street_sinclair_fifth_sixth_1"/>
        <link type="basic" dist="CLOSE" dir="S" area="street_fifth_sinclair_archer_1"/>
    </area>
    <area id="street_corner_fifth_archer_1" room="street_corner_fifth_archer">
        <link type="basic" dist="CLOSE" dir="E" area="street_archer_fifth_sixth_1"/>
        <link type="basic" dist="CLOSE" dir="N" area="street_fifth_sinclair_archer_2"/>
        <object id="wilsons_corner_store_exterior_door" template="door_basic">
            <localVar name="door_link_object">"wilsons_corner_store_door_exit"</localVar>
            <localVar name="door_link_dir">"NE"</localVar>
        </object>
    </area>
    <area id="street_corner_sixth_sinclair_1" room="street_corner_sixth_sinclair">
        <link type="basic" dist="CLOSE" dir="W" area="street_sinclair_fifth_sixth_3"/>
        <link type="basic" dist="CLOSE" dir="S" area="street_sixth_sinclair_archer_1"/>
    </area>
    <area id="street_corner_sixth_archer_1" room="street_corner_sixth_archer">
        <link type="basic" dist="CLOSE" dir="W" area="street_archer_fifth_sixth_3"/>
        <link type="basic" dist="CLOSE" dir="N" area="street_sixth_sinclair_archer_2"/>
    </area>
    <area id="street_sinclair_fifth_sixth_1" room="street_sinclair_fifth_sixth">
        <link type="basic" dist="CLOSE" dir="W" area="street_corner_fifth_sinclair_1"/>
        <link type="basic" dist="CLOSE" dir="E" area="street_sinclair_fifth_sixth_2"/>
    </area>
    <area id="street_sinclair_fifth_sixth_2" room="street_sinclair_fifth_sixth">
        <link type="basic" dist="CLOSE" dir="W" area="street_sinclair_fifth_sixth_1"/>
        <link type="basic" dist="CLOSE" dir="E" area="street_sinclair_fifth_sixth_3"/>
        <link type="basic" dist="CLOSE" dir="S" area="alley_archer_fifth_sixth_1"/>
    </area>
    <area id="street_sinclair_fifth_sixth_3" room="street_sinclair_fifth_sixth">
        <link type="basic" dist="CLOSE" dir="W" area="street_sinclair_fifth_sixth_2"/>
        <link type="basic" dist="CLOSE" dir="E" area="street_corner_sixth_sinclair_1"/>
    </area>
    <area id="street_archer_fifth_sixth_1" room="street_archer_fifth_sixth">
        <link type="basic" dist="CLOSE" dir="W" area="street_corner_fifth_archer_1"/>
        <link type="basic" dist="CLOSE" dir="E" area="street_archer_fifth_sixth_2"/>
        <object id="wilsons_corner_store_exterior_vending_machine" template="vending_machine_nitron"/>
        <object id="archer_apartments_exterior_door" template="door_basic">
            <localVar name="door_link_object">"archer_apartments_entrance_door"</localVar>
            <localVar name="door_link_dir">"N"</localVar>
        </object>
    </area>
    <area id="street_archer_fifth_sixth_2" room="street_archer_fifth_sixth">
        <link type="basic" dist="CLOSE" dir="W" area="street_archer_fifth_sixth_1"/>
        <link type="basic" dist="CLOSE" dir="E" area="street_archer_fifth_sixth_3"/>
        <link type="basic" dist="CLOSE" dir="N" area="alley_archer_fifth_sixth_3"/>
    </area>
    <area id="street_archer_fifth_sixth_3" room="street_archer_fifth_sixth">
        <link type="basic" dist="CLOSE" dir="W" area="street_archer_fifth_sixth_2"/>
        <link type="basic" dist="CLOSE" dir="E" area="street_corner_sixth_archer_1"/>
    </area>
    <area id="street_fifth_sinclair_archer_1" room="street_fifth_sinclair_archer">
        <link type="basic" dist="CLOSE" dir="S" area="street_fifth_sinclair_archer_2"/>
        <link type="basic" dist="CLOSE" dir="N" area="street_corner_fifth_sinclair_1"/>
    </area>
    <area id="street_fifth_sinclair_archer_2" room="street_fifth_sinclair_archer">
        <link type="basic" dist="CLOSE" dir="N" area="street_fifth_sinclair_archer_1"/>
        <link type="basic" dist="CLOSE" dir="S" area="street_corner_fifth_archer_1"/>
        <object id="test_motorcycle" template="motorcycle"/>
    </area>
    <area id="street_sixth_sinclair_archer_1" room="street_sixth_sinclair_archer">
        <link type="basic" dist="CLOSE" dir="S" area="street_sixth_sinclair_archer_2"/>
        <link type="basic" dist="CLOSE" dir="N" area="street_corner_sixth_sinclair_1"/>
    </area>
    <area id="street_sixth_sinclair_archer_2" room="street_sixth_sinclair_archer">
        <link type="basic" dist="CLOSE" dir="N" area="street_sixth_sinclair_archer_1"/>
        <link type="basic" dist="CLOSE" dir="S" area="street_corner_sixth_archer_1"/>
    </area>
    <area id="alley_archer_fifth_sixth_1" room="alley_archer_fifth_sixth">
        <link type="basic" dist="CLOSE" dir="N" area="street_sinclair_fifth_sixth_2"/>
        <link type="basic" dist="CLOSE" dir="S" area="alley_archer_fifth_sixth_2"/>
    </area>
    <area id="alley_archer_fifth_sixth_2" room="alley_archer_fifth_sixth">
        <link type="basic" dist="CLOSE" dir="N" area="alley_archer_fifth_sixth_1"/>
        <link type="basic" dist="CLOSE" dir="S" area="alley_archer_fifth_sixth_3"/>
        <object id="wilsons_corner_store_exterior_backroom_door" template="door_basic">
            <localVar name="door_link_object">"wilsons_corner_store_backroom_exit"</localVar>
            <localVar name="door_link_dir">"W"</localVar>
        </object>
    </area>
    <area id="alley_archer_fifth_sixth_3" room="alley_archer_fifth_sixth">
        <link type="basic" dist="CLOSE" dir="N" area="alley_archer_fifth_sixth_2"/>
        <link type="basic" dist="CLOSE" dir="S" area="street_archer_fifth_sixth_2"/>
    </area>
</data>